{
  "version": "simulation-framework-v1",
  "bayesian": {
    "source_tier_weights": {
      "tier1": 1.2,
      "tier2": 1.0,
      "tier3": 0.8,
      "default": 0.9
    },
    "half_life_days": 90.0
  },
  "markov": {
    "default_horizon_steps": 12,
    "states": ["stable", "escalating", "crisis", "deescalating"]
  },
  "monte_carlo": {
    "runs": 500,
    "steps": 60,
    "jump_probability": 0.02,
    "jump_mean": 0.0,
    "jump_std": 0.03
  }
}
